institution,Date,Title,URL,tone,mentions_cooperation,mentions_competition,cooperation_type,thematic_tags,justification,length_words
BGU,03.12.2024,פרס בוני ציון הוענק לפרופ' כרמי צ. מרגלית,https://www.bgu.ac.il/articles/boney-zion-prof-carmi/,mixed,yes,yes,international;education;award;immigration,The article highlights an international award recognizing contributions in various fields while emphasizing the significance of unique contributions by immigrants.,ERR,719
BGU,01.12.2024,איזה מודל  AIמפענח מידע רפואי בצורה הטובה ביותר?,https://www.bgu.ac.il/articles/which-ai-model-best-deciphers-medical-information/,mixed,no,yes,none,AI;medical;research;evaluation,The article discusses both the evaluation of language models and the capabilities of specific models,479
BGU,28.11.2024,"סכנה מבפנים: איך חיים עם מלחמה, טראומה וחשיפה לאלימות?",https://www.bgu.ac.il/articles/international-day-for-the-elimination-of-violence-against-women-2024/,mixed,yes,no,none,gender;violence;war impact,The article discusses collaboration in combating violence against women during war but doesn't highlight competition.,667
BGU,27.11.2024,מקבלי אות בן-גוריון,https://www.bgu.ac.il/articles/prizes/,mixed,yes,yes,inter-university;international,academic awards;social impact;community engagement;innovation,The article highlights both the honoring of individuals for unique contributions (competitive) and the collaborative efforts and partnerships for social impact (cooperative).,1435
BGU,25.11.2024,"דו""ח מצב בריאות הנפש של ילדי ישראל לאחר אירועי השבעה באוקטובר הוגש לנשיא המדינה",https://www.bgu.ac.il/articles/report-on-state-of-mental-health-of-the-children-of-israel-after-7-10-events-submitted-to-president-of-israel/,cooperative,yes,no,inter-university,mental health;children;education;policy;collaboration,The article emphasizes a joint effort involving multiple researchers and institutions to address children's mental health.,261
BGU,20.11.2024,איפה ישנם עוד אנשים כמו האיש ההוא,https://www.bgu.ac.il/articles/yadlin-11-24/,neutral,no,no,none,memorial;tribute;education,The article is purely informational,288
BGU,19.11.2024,"מחקר כזירת זיכרון: הסטודנטית נרצחה ב-7 באוקטובר, מחקרה הוצג כעבור שנה באוניברסיטת אוקספורד",https://www.bgu.ac.il/articles/research-as-an-arena-of-memory/,neutral,no,no,none,memorial;tragedy;remembrance,No signs of competition or collaboration were found.,423
BGU,19.11.2024,כובשת את החלל,https://www.bgu.ac.il/articles/conquering-space/,cooperative,yes,no,international;inter-university,space;remote sensing;international collaboration;climate change,The article emphasizes international collaboration through Dr. Maman's role in the IAF and satellite data projects.,256
BGU,13.11.2024,מה עוזר לקהילות העוטף להתמודד עם הטראומה?,https://www.bgu.ac.il/articles/gazacommunities/,mixed,no,no,none,psychology;community resilience;conflict management,The article includes elements of both research findings and a focus on community resilience without clear domination of either competition or collaboration.,479
BGU,13.11.2024,גילוי חדש על קרום התא: איך זה ישפיע על הבריאות שלנו?,https://www.bgu.ac.il/articles/membrane/,cooperative,yes,no,inter-university,cellular processes;viscosity;biotechnology,The article emphasizes collaboration between universities in conducting research.,356
BGU,10.11.2024,הדאגה משינויי האקלים חוצה מחנות פוליטיים,https://www.bgu.ac.il/articles/new-survey-by-the-national-institute-for-climate-policy-research-at-ben-gurion-university-of-the-negev-found-an-absolute-majority-of-the-israeli-public-fears-climate-change-concern-about-climate-change-crosses-political-lines/,cooperative,yes,no,inter-university,climate change;public opinion;environmental policy,The article highlights collaboration in conducting the survey between different research entities within the university.,743
BGU,06.11.2024,במשך 15 שנה הציבור שילם על הטבה לא אפקטיבית,https://www.bgu.ac.il/articles/israeli-public-paid-for-ineffective-benefit-green-tax-reform-for-15-years-time-to-revamp/,neutral,no,no,none,environment;policy;transportation,No signs of competition or collaboration were found.,519
BGU,05.11.2024,מחברים בין עשייה ומחקר בחינוך,https://www.bgu.ac.il/articles/connecting-action-and-research-in-education/,cooperative,yes,no,inter-university;industry;international,education;social_impact;academic_research,The article highlights multiple partnerships among universities,344
BGU,04.11.2024,בקרת הסוכר בגוף האדם- מרכיב דרמטי בהאטת הזדקנות המוח בעזרת תזונה,https://www.bgu.ac.il/articles/sugar-control-in-human-body-a-dramatic-component-in-slowing-brain-aging/,cooperative,yes,no,international,aging;nutrition;brain health;international collaboration,The article highlights international collaboration in a large-scale research project.,618
BGU,03.11.2024,האוניברסיטה מציגה: הצטיינות בכל החזיתות,https://www.bgu.ac.il/articles/ben-gurion-university-of-the-negev-presents-excellence-on-all-fronts/,cooperative,yes,no,inter-university;community support,education;military service;community support;geopolitical awareness;medical education,The article highlights the university's efforts to support students serving in the military and emphasizes community support and cooperation.,613
BGU,29.10.2024,נשים נרתעות לחלוק משוב שלילי באתרי צרכנות מקוונים,https://www.bgu.ac.il/articles/study-reveals-gender-rating-gap-in-online-reviews/,cooperative,yes,no,inter-university,gender studies;online reviews;social behavior,The article highlights joint research between multiple universities.,703
BGU,28.10.2024,התפקיד האימהי בעת חשיפה לאירוע טראומטי,https://www.bgu.ac.il/articles/the-maternal-role-during-exposure-to-a-traumatic-event/,cooperative,yes,no,international,psychology;parenting;mental health;security,The article emphasizes collaboration between researchers and international funding support.,749
BGU,28.10.2024,"לקראת הבחירות בארה""ב: כיצד נוכל לזהות ""פייק ניוז""?",https://www.bgu.ac.il/articles/new-machine-learning-model-identifies-fake-news-sources-more-reliably/,neutral,yes,no,none,technology;machine learning;fact-checking,No signs of competition or collaboration were found.,364
BGU,27.10.2024,פרידה מענק: פרופסור עמוס ריצ'מונד הלך לעולמו,https://www.bgu.ac.il/articles/richmondamos/,cooperative,yes,no,inter-university;international,history;recognition;contributions;academia;collaboration,The article highlights collaboration between Amos Richmond and Yehiel Admoni in establishing desert research institutes.,279
BGU,27.10.2024,מענק יוקרתי מטעם הקרן הלאומית למדע לפרופ' יגאל מאיר,https://www.bgu.ac.il/articles/from-physics-laboratories-to-national-science-foundation-grant/,competitive,no,yes,none,quantum computing;research funding;scientific achievements,The article emphasizes significant achievements and prestigious funding in quantum research.,152
BGU,13.10.2024,כיצד השפיעו שימוש בסמים ואלכוהול על בריאות הנפש של ניצולי הנובה?,https://www.bgu.ac.il/articles/did-the-use-of-drugs-and-alcohol-affect-the-mental-health-of-the-nova-survivors/,cooperative,yes,no,inter-university,psychology;mental health;trauma;substance use;collaboration,The article highlights a joint study between Ben-Gurion University and Sheba Medical Center on trauma responses.,617
BGU,13.10.2024,פרופ' שי ארנון מונה למנהל מכון צוקרברג לחקר המים,https://www.bgu.ac.il/articles/prof-shay-arnon-appointed-director-of-the-zuckerberg-institute-for-water-research/,cooperative,yes,no,international,water research;sustainability;education,The article emphasizes collaboration and leadership in international water research efforts.,156
BGU,10.10.2024,"דו""ח מיוחד: תיעוד החמ""לים הקדמיים בשבעה באוקטובר",https://www.bgu.ac.il/articles/documentation-of-frontal-commanders-on-7-10-23/,neutral,yes,no,none,military;gender studies;reporting,The article focuses on research and findings without highlighting collaboration or competition.,1301
BGU,09.10.2024,פרס מפעל חיים לפרופ' אמיר שגיא במלזיה,https://www.bgu.ac.il/articles/prof-amir-sagi-receives-lifetime-achievement-award/,mixed,yes,yes,international,biotechnology;hormone research;international relations,The article highlights both international cooperation in research and the competitive aspect of receiving a prestigious award.,387
BGU,29.09.2024,מחקר למען נשים שנפגעו בטחונית ומינית,https://www.bgu.ac.il/articles/victims-of-sexual-activity-living-in-the-gaza-envelope-experience-a-double-harm/,mixed,yes,no,inter-university,trauma;community resilience;mental health,The article discusses a collaborative research between academic institutions but primarily focuses on the findings rather than competitive aspects.,757
BGU,29.09.2024,חדש: חטיבת מוזיקה באוניברסיטה,https://www.bgu.ac.il/articles/new-music-in-arts/,neutral,no,no,none,music;education;appointments,No signs of competition or collaboration were found.,272
BGU,29.09.2024,מי מפחד מקורסי אנגלית?,https://www.bgu.ac.il/articles/english/,neutral,no,no,none,language education;skills development,No signs of competition or collaboration were found.,318
BGU,23.09.2024,"תמר זנדברג תשמש כיו""ר ארגוני הגג של ארגוני הסביבה בישראל",https://www.bgu.ac.il/articles/tamarzan/,mixed,yes,yes,inter-university,environment;policy;sustainability;climate change,The article highlights both cooperation in environmental efforts and individual achievements in academia.,420
BGU,15.09.2024,כנס שדה בוקר ה-24 של אוניברסיטת בן-גוריון,https://www.bgu.ac.il/articles/sedeboqersymposium/,cooperative,yes,no,inter-university;international,energy;solar;innovation;research,The article emphasizes collaboration and shared goals in renewable energy advancements and symposium discussions.,266
BGU,12.09.2024,"מצעד הקורסים המפתיעים תשפ""ה",https://www.bgu.ac.il/articles/general-courses/,neutral,no,no,none,courses;surprising,No signs of competition or collaboration were found.,373
BGU,10.09.2024,אם זכרוני אינו מטעני,https://www.bgu.ac.il/articles/memory/,cooperative,yes,no,inter-university,cognitive science;memory;human behavior;AI collaboration,The article highlights collaboration between multiple universities in research.,521
BGU,09.09.2024,מענק ERC לחוקר בינה מלאכותית מאוניברסיטת בן-גוריון בנגב,https://www.bgu.ac.il/articles/erc/,competitive,no,yes,none,AI;wireless communication;ERC grant;innovation,The article emphasizes the significant ERC grant award and novel AI research advancements.,302
BGU,09.09.2024,מומחי AI הוכיחו פערים באופן הסיקור של ה-BBC,https://www.bgu.ac.il/articles/bbc/,cooperative,yes,no,industry,journalism;AI;media,The article highlights a collaborative AI research effort to analyze media bias.,189
BGU,09.09.2024,כיצד הבינה המלאכותית מסייעת לרופאים לפענח תמונות רפואיות?,https://www.bgu.ac.il/articles/imagimg/,cooperative,yes,no,industry,AI;medical imaging;fertility;collaboration,The article highlights a collaboration between Ben-Gurion University and the startup AIVF for AI research.,770
BGU,05.09.2024,לא רק רץ למיליון: יפתח רמון בביקור מיוחד באוניברסיטת בן-גוריון בנגב,https://www.bgu.ac.il/articles/ramon/,cooperative,yes,no,inter-university;industry;international,education;science;technology;space,The article highlights potential partnerships and collaborations between the university and the Ramon Foundation.,263
BGU,03.09.2024,נמצאו חיידקים במעיים הקשורים לסוכרת מסוג 2,https://www.bgu.ac.il/articles/diabetes/,cooperative,yes,no,international,diabetes;microbiome;international collaboration;research,The article emphasizes an international research collaboration involving multiple universities and research groups across different countries.,568
BGU,01.09.2024,כובשים יעדים: המשלחת המתמטית של אוניברסיטת בן-גוריון בנגב זוכה להישגים בתחרות ה-IMC,https://www.bgu.ac.il/articles/goals/,competitive,no,yes,none,competitions;student achievements;mathematics,The article emphasizes the students' achievements and ranks in an international competition.,289
BGU,28.08.2024,יחידה ומיוחדת: אוניברסיטת בן-גוריון משלבת אוכלוסייה על הרצף האוטיסטי במרחב האקדמי,https://www.bgu.ac.il/articles/alut/,cooperative,yes,no,industry;none,inclusion;education;social impact;disability,The article highlights a collaborative project aimed at inclusion and social impact.,161
BGU,27.08.2024,מחקר בינתחומי מיישם עקרונות מאקולוגיה וביולוגיה של סרטן,https://www.bgu.ac.il/articles/ecology-and-biology-in-cancer-research/,mixed,yes,yes,inter-university;cancer research;interdisciplinary approach;protein interactions;ecological networks,The article discusses an interdisciplinary research project combining ecological and cancer biology methods, showcasing both collaboration and groundbreaking innovation.,457
BGU,19.08.2024,שילוב דגים וירקות- עוד לפני שהם מגיעים לצלחת,https://www.bgu.ac.il/articles/bgu-researchers-offer-proof-of-concept-for-unique-aquaponics-system/,cooperative,yes,no,international;sustainability;agriculture;food security;innovation,The article highlights international collaboration and joint research efforts.,ERR,455
BGU,18.08.2024,מהפכת ה-DATA ברפואה כבר כאן,https://www.bgu.ac.il/articles/data-revolution-in-medicine-ma-in-epidemiology-and-medical-data-science/,competitive,no,yes,none,healthcare;innovation;education,The article emphasizes the department as a leading authority in Israel and focuses on innovation and advanced solutions in healthcare.,299
BGU,08.08.2024,מבן-גוריון לאולימפיאדה בפריז,https://www.bgu.ac.il/articles/olympic-games-2024/,competitive,no,yes,none,sports;academia;personal journey,The article highlights Noa's achievements and competitive nature in sports and her pursuit of excellence in academia.,288
BGU,06.08.2024,"על צבאים, תנים, ואנשים – ניהול מושכל של מטיילים יאפשר דו-קיום בטבע",https://www.bgu.ac.il/articles/deer/,cooperative,yes,no,inter-university;industry;international,ecology;wildlife conservation;human impact,The article emphasizes collaboration between multiple institutions and stakeholders for wildlife research.,451
BGU,06.08.2024,סובלים מהשמנת יתר?,https://www.bgu.ac.il/articles/obesity/,cooperative,yes,no,inter-university;industry;international,personalized medicine;obesity;medical research;multidisciplinary,The article highlights cooperation between various researchers and institutions in a multidisciplinary study.,538
BGU,01.08.2024,הסכם קיבוצי ייחודי להעסקת  עובדות ועובדי הניקיון באוניברסיטה,https://www.bgu.ac.il/articles/cleaning/,cooperative,yes,no,inter-university,social change;employment;university initiative,The article highlights collaboration between universities to improve employment conditions.,240
BGU,29.07.2024,מפתח עברית להצלחת הנגב,https://www.bgu.ac.il/articles/negev/,cooperative,yes,no,inter-university;industry;international,education;language;social integration,The article highlights collaboration between the university,230
BGU,28.07.2024,אגדה מהלכת: ההלך האולימפי שאול לדני חוזר למסלול,https://www.bgu.ac.il/articles/shaul-ladany/,mixed,no,yes,none,sports;personal achievements;health,The article covers both Ladany's competitive achievements and his personal health journey.,367
BGU,25.07.2024,אוניברסיטת בן-גוריון אימצה את הגדרת האנטישמיות של הברית הבינלאומית לשימור זכר השואה,https://www.bgu.ac.il/articles/antisemitism/,neutral,no,no,none,antisemitism;policy;definitions,No signs of competition or collaboration were found.,242
BGU,24.07.2024,רובוטים חברתיים יעילים יותר בשיקום לאחר שבץ,https://www.bgu.ac.il/articles/socialrobots/,mixed,yes,yes,inter-university;industry;international,rehabilitation;innovation;robotics,The article mentions both cooperation with hospitals and competition through superior results with robots.,432
BGU,24.07.2024,11 מדליות אולימפיות לחברי נבחרות ישראל בפיזיקה ובמתמטיקה,https://www.bgu.ac.il/articles/physicshosidman/,mixed,yes,yes,inter-university;international,science education;awards;international competition;academic excellence,The article highlights both international competition success and inter-university cooperation.,702
BGU,23.07.2024,מי ישמור על המגוון הביולוגי באזורים הצחיחים?,https://www.bgu.ac.il/articles/gazella/,mixed,yes,yes,international,ecology;climate change;conservation,The article discusses collaboration between universities and also highlights threats and challenges to desert conservation.,503
BGU,22.07.2024,פרופ' לואיזה משי מונתה לתפקיד סגנית הרקטור לענייני הוראה,https://www.bgu.ac.il/articles/meshi-new-vice-provost/,cooperative,yes,yes,inter-university;industry;international,academic leadership;innovation;awards;strategic planning;international collaboration,The article highlights collaborative educational initiatives and awards,236
BGU,22.07.2024,מצוינות מחקרית ביום המדענית 2024,https://www.bgu.ac.il/articles/research-excellence-on-women-in-science-day-2024/,neutral,no,no,none,gender equality;women in STEM,No signs of competition or collaboration were found.,383
BGU,22.07.2024,מינוי חדש: פרופ' הללי פינסון- נציבת הקבילות לענייני הטרדה מינית באוניברסיטת בן גוריון,https://www.bgu.ac.il/articles/halelipinson/,cooperative,yes,no,inter-university,gender equality;academic leadership,The article emphasizes collaborative efforts to change policies regarding sexual harassment and promote gender equity.,144
BGU,21.07.2024,מיזם סטודנטיאלי ישפר תהליכי אימות מסמכים במשרד האוכלוסין וההגירה באמצעות ענן ו-AI,https://www.bgu.ac.il/articles/sli10/,cooperative,yes,no,inter-university;industry;international,innovation;public sector;technology,The article highlights collaboration between the government,789
BGU,18.07.2024,ברור כשמש: בית הספר לקיימות ושינויי אקלים בחזית המאבק מול המשברים הסביבתיים,https://www.bgu.ac.il/articles/climate2024/,cooperative,yes,no,inter-university;society,The article highlights academic responsibility and collaboration in addressing environmental issues.,ERR,339
BGU,16.07.2024,מחשבים כלים מחדש: כלי חישובי חדש מבית היוצר של אוניברסיטת בן-גוריון בנגב,https://www.bgu.ac.il/articles/bioinformatics/,mixed,yes,yes,inter-university;international,numerical analysis;bioinformatics;RNA sequencing;artificial intelligence;collaboration;innovation;research,The article highlights both collaboration in the research team's multidisciplinary work and innovation in developing a new computational tool.,387
BGU,16.07.2024,עכביש האלמנה החומה פולש לישראל ומארח חיידק הקשור לכלמידיה,https://www.bgu.ac.il/articles/brown-widow/,mixed,yes,yes,international,bacteria;invasive_species;ecology,The article discusses both the collaborative international research and the competitive aspects of the research findings on invasive species adaptability.,400
BGU,14.07.2024,מילון הדינוזאורים האקדמי,https://www.bgu.ac.il/articles/dinosaurs/,competitive,no,yes,none,history;innovation;celebration,The article highlights the university's leading achievements thanks to a key figure.,39
BGU,14.07.2024,דוקטורנט (ממש) מצטיין פוגש נובליסטים,https://www.bgu.ac.il/articles/tal-adi/,competitive,no,yes,none,academic excellence;awards;cosmology,The article emphasizes the student's numerous awards and achievements,112
BGU,10.07.2024,ברור כשמש: בית הספר לקיימות ושינויי אקלים בחזית המאבק מול המשברים הסביבתיים,https://www.bgu.ac.il/articles/climateconference/,cooperative,yes,no,inter-university,sustainability;climate change;academia-community collaboration,The article highlights cooperation among academic institutions and community for sustainability.,356
BGU,08.07.2024,שגרירות על-חלל,https://www.bgu.ac.il/articles/space-un/,cooperative,yes,no,international,space;education;gender equality,The article highlights international collaboration to promote women's participation in space research.,457
BGU,08.07.2024,"פרופ' דניאל חיימוביץ, נשיא האוניברסיטה נבחר לכהן כיו""ר ו""רה",https://www.bgu.ac.il/articles/president-chamovitz-head-of-vera/,neutral,no,no,none,none,ERR,0
BGU,07.07.2024,הטובות והטובים לטיס ולבן-גוריון,https://www.bgu.ac.il/articles/new-pilots/,cooperative,yes,no,inter-university,education;military;cooperation,The article highlights the joint educational program between the university and the air force.,537
BGU,07.07.2024,גורם המשיכה של שירת ציפורים,https://www.bgu.ac.il/articles/birds/,cooperative,yes,no,inter-university,ornithology;bird_migration;environmental_protection,The article highlights a collaborative research effort between Ben-Gurion University and University of Haifa.,598
BGU,07.07.2024,מכל תלמידיי השכלתי,https://www.bgu.ac.il/articles/learning-from-my-students/,cooperative,yes,no,industry,social inclusion;higher education;community engagement,The article emphasizes collaboration with social organizations for community benefit.,480
BGU,03.07.2024,תוכנית נגב פריים מקדמת יזמות איקומרס,https://www.bgu.ac.il/articles/negev-prime-ecommerce/,cooperative,yes,no,inter-university;industry;community,entrepreneurship;e-commerce;education;innovation,The article emphasizes collaboration between the university,494
BGU,01.07.2024,"רוני בהט תכהן כסמנכ""לית השיווק של האוניברסיטה",https://www.bgu.ac.il/articles/roni-bahat-new-cmo-1-7-24/,competitive,no,yes,none,marketing;higher education;leadership,The article emphasizes the competitive nature of higher education and the ambitious goals set by the university.,82
BGU,01.07.2024,מגמה ייחודית בשיקום תפתח במסגרת התואר השני בפיזיותרפיה,https://www.bgu.ac.il/articles/nique-major-in-rehabilitation/,cooperative,yes,no,inter-university,rehabilitation;interdisciplinary education;healthcare,A partnership between departments is emphasized to create a unique rehabilitation program.,370
BGU,30.06.2024,בונות מנהיגות נשית,https://www.bgu.ac.il/articles/women-leadership/,cooperative,yes,no,inter-university;international,leadership;Zionism;innovation;young leadership,The article highlights a partnership between Ben-Gurion University and the World Zionist Organization for an international leadership program.,214
BGU,27.06.2024,הכנס השני לשוויוניות בבריאות בפריפריה,https://www.bgu.ac.il/articles/halth-equality/,cooperative,yes,no,inter-university;industry;government,healthcare;inequality;regional development;emergency response,The article highlights collaborative efforts between universities and other stakeholders to address health disparities.,848
BGU,23.06.2024,1.2 מיליון דולר מענק לפרופ' מיכאל מיילר מהמחלקה לכימיה,https://www.bgu.ac.il/articles/meijler-grant-from-hfsp/,cooperative,yes,no,international,neuroscience;microbiology;gut-brain axis,The article highlights international collaboration in research efforts.,235
BGU,23.06.2024,עוטפים את העוטף: מלגות הוענקו לסטודנטיות וסטודנטים המתגוררים בעוטף עזה ולומדים באוניברסיטת בן-גוריון,https://www.bgu.ac.il/articles/otef/,cooperative,yes,no,international,charity;scholarships;student_support,The article emphasizes international cooperation to support students with scholarships.,199
BGU,23.06.2024,מלגת מעונות למשרתי ומשרתות מילואים במלחמת חרבות ברזל,https://www.bgu.ac.il/articles/reserve-housing/,neutral,no,no,none,scholarships;housing;student life,No signs of competition or collaboration were found.,123
