institution,Date,Title,URL,tone,mentions_cooperation,mentions_competition,cooperation_type,thematic_tags,justification,length_words
BGU,19.06.2024,חילזון ללא גבולות,https://www.bgu.ac.il/articles/dendropoma/,cooperative,yes,no,inter-university;industry;international,environmental science;marine biology;conservation,The article highlights collaboration between the university and other organizations for research purposes.,417
BGU,18.06.2024,איום מכיוון אחר: למלחמת ישראל-חמאס השלכות מזיקות גם על הביטחון התזונתי בישראל,https://www.bgu.ac.il/articles/food-sec/,neutral,no,no,none,food_security;agriculture;conflict_analysis,No signs of competition or collaboration were found.,652
BGU,18.06.2024,מצוינות אקדמית: האוניברסיטה העניקה פרסים ל-12 חוקרות וחוקרים מצטיינים,https://www.bgu.ac.il/articles/excellent-research/,competitive,no,yes,none,awards;research excellence;science;community involvement,The article emphasizes prestigious awards given for outstanding academic achievements.,373
BGU,17.06.2024,תואר שני לסטודנטים וסטודנטיות מהחברה הערבית בתחום הסביבה והקיימות,https://www.bgu.ac.il/articles/ma-for-arab-students-in-the-field-of-environment-and-sustainability/,cooperative,yes,no,inter-university;industry;international,climate change;environmental education;Arab society;interdisciplinary collaboration,The article highlights collaboration between universities and organizations for environmental education in the Arab society.,279
BGU,06.06.2024,1.3 מיליון דולר מענק למחקר בתחום מיגור הפוליו,https://www.bgu.ac.il/articles/grant-for-research-in-the-field-of-polio-eradication/,mixed,yes,yes,inter-university;international,vaccines;research;global health,The article describes both collaborative vaccine development efforts and highlights the innovative research and commercialization achievements.,220
BGU,04.06.2024,226 רופאות ורופאים חדשים,https://www.bgu.ac.il/articles/md-grads-2024/,cooperative,yes,no,none,graduation;humanitarianism;unity;resilience;medicine,The article highlights unity and mutual support among the medical graduates and staff.,300
BGU,30.05.2024,פרופ' סראב אבו-רביעה קווידר עוטרה בתואר דוקטור לאות כבוד מטעם מכון ויצמן למדע,https://www.bgu.ac.il/articles/honorary-doctorate-to-prof-sarab-abu-rabia-queder/,competitive,no,yes,none,gender studies;social justice;minority rights,The article emphasizes the unique achievements and recognition of a professor with international affiliations.,160
BGU,30.05.2024,מפתח שבדי לתהילה: תלמידת מרכז חוסידמן באוניברסיטת בן-גוריון תייצג את ישראל בתחרות פרס המים של שטוקהולם,https://www.bgu.ac.il/articles/student-of-jusidman-center-to-represent-israel-in-the-stockholm-water-prize-competition/,competitive,no,yes,none,water conservation;education;innovation,The article emphasizes the prestigious award and international competition participation.,299
BGU,27.05.2024,"קונגרס הקיימות הציוני הראשון"" ""הצעירים לוקחים אחריות""",https://www.bgu.ac.il/articles/young-israeli-generation-convenes-for-first-zionist-sustainability-congress/,cooperative,yes,no,inter-university,sustainability;education;community engagement,The article emphasizes joint efforts and collaboration for sustainability involving multiple institutions.,409
BGU,23.05.2024,באו מאהבה,https://www.bgu.ac.il/articles/bog54-yehudit-ravitz-release-all-hostages/,mixed,yes,yes,inter-university;industry,governance;recognition;resilience;ceremony,The article includes both cooperation with international figures and institutions and competition as it highlights awards and special recognitions.,782
BGU,21.05.2024,הרעבת גלוקוז גם כטיפול נגד סרטן,https://www.bgu.ac.il/articles/rotblat-glucose-starvation/,cooperative,yes,no,inter-university,research;medicine;oncology;biotechnology,The article highlights a joint research collaboration between Ben-Gurion University and a German institution.,429
BGU,21.05.2024,"""מעטפת חוסן"" - מסייעת לתקומת הקהילות שנפגעו במלחמה",https://www.bgu.ac.il/articles/resilience-shell/,cooperative,yes,no,industry;governance;technology,The article emphasizes collaboration and joint efforts in deploying a resilience system for communities affected by war.,ERR,429
BGU,21.05.2024,גישה חדשנית למחלת ALS: העלאת רמות החלבון MIF בתאי עצב,https://www.bgu.ac.il/articles/innovative-approach-to-als/,cooperative,yes,no,international,neurology;ALS;international collaboration;protein research,The article highlights international collaboration among universities to research ALS.,544
BGU,12.05.2024,יונית לוי תקבל פרס על סיקור אובייקטיבי במזרח התיכון,https://www.bgu.ac.il/articles/yonit-levy/,neutral,no,yes,none,journalism;awards;Middle East coverage,The article focuses on an award without mentioning cooperation efforts.,430
BGU,09.05.2024,מומחים ממליצים לממשלת ישראל לגבש בהקדם אסטרטגיה ישראלית לדיפלומטיית ספורט,https://www.bgu.ac.il/articles/sports-diplomacy-strategy/,mixed,yes,yes,international,sports;diplomacy;Middle East,The article discusses both collaborative efforts in sports diplomacy and competitive elements regarding Israel's legal position in FIFA.,174
BGU,08.05.2024,חוק פיזיקלי: חוקרים מהמחלקה לפיזיקה בבן-גוריון רושמים הישגים,https://www.bgu.ac.il/articles/physicists-achievements/,competitive,no,yes,none,awards;recognition;physics;research,The article emphasizes awards and recognition received by the professors in the field of physics.,208
BGU,08.05.2024,האוניברסיטה בשיתוף יזמים וחברות טכנולוגיה רב לאומיות השיקו את The Institute - מיזם ליצירת מובילות ישראלית בעידן ה- AI,https://www.bgu.ac.il/articles/ai-initiative/,cooperative,yes,no,industry;inter-university,innovation;AI;education;collaboration;technology,The article highlights a collaborative AI initiative involving universities and industry leaders.,452
BGU,07.05.2024,האם שקרנים סדרתיים יכולים להיחשב כנים?,https://www.bgu.ac.il/articles/can-serial-liars-be-considered-honest/,mixed,yes,no,international,psychology;political science;misinformation,The article discusses both international research collaboration and the study of misinformation without any clear competition emphasis.,515
BGU,07.05.2024,"הכדור עובר לבן-גוריון: ניגשים לבגרות במדעי כדור הארץ והסביבה במטרה לשרת ביחידת מודיעין צה""לית",https://www.bgu.ac.il/articles/earth-and-environmental-science-in-highschool-for-idf-intelligence-service/,cooperative,yes,no,inter-university;youth engagement;education;climate change,The article highlights a collaborative effort involving multiple institutions to educate youth on climate issues.,ERR,303
BGU,05.05.2024,קשה לצפייה: שואת יהודי אירופה והטבח בעוטף עזה דרך משקפי מציאות מדומה,https://www.bgu.ac.il/articles/holocaust-and-7-october-massacre-through-vr-glasses/,mixed,yes,no,inter-university,virtual reality;Holocaust education;Southern Israel conflict,The article highlights cooperation in creating a virtual tour while emphasizing the importance and potential of VR technology in heritage preservation.,452
BGU,18.04.2024,"ניהול מגה-אר""ן: לקחי מד""א ממתקפת ה-7.10",https://www.bgu.ac.il/articles/managing-mega-multi-casualty-incident-7-10-23/,cooperative,yes,no,inter-university;industry,public_health;emergency_response;medical_challenges,The article highlights a joint report with Magen David Adom emphasizing cooperative efforts in emergency response.,576
BGU,16.04.2024,התוכן והעיצוב של תוויות אנרגיה משפיעים על רכישת כלי רכב חשמליים,https://www.bgu.ac.il/articles/energy-labels-research/,neutral,no,no,none,environmental studies;consumer behavior;policy recommendations,No signs of competition or collaboration were found.,686
BGU,15.04.2024,חוקרת מהאוניברסיטה מונתה לעורכת ראשית בכתב עת בינלאומי,https://www.bgu.ac.il/articles/dana-vadar-weiss-editor/,competitive,no,yes,none,education;academic publishing;international recognition;science education,The article emphasizes the prestige and uniqueness of the appointment as it is the first time an editor from outside the US and from Israel is selected for this leading journal.,204
BGU,11.04.2024,"הלוחמת באנטישמיות תקבל תואר ד""ר לשם כבוד מאוניברסיטת בן-גוריון בנגב",https://www.bgu.ac.il/articles/bgu-to-honor-katharina-von-schnurbein/,mixed,yes,no,inter-university;international,anti-Semitism;Jewish life;honorary degree;European Union,The article discusses cooperation with universities for combating anti-Semitism but also focuses on her unique role and achievements.,297
BGU,10.04.2024,בינה מלאכותית תשחזר טקסטים יהודיים עתיקים,https://www.bgu.ac.il/articles/ai-can-rediscover-illegible-letters-in-ancient-inscriptions/,cooperative,no,yes,none,artificial intelligence;archaeology;linguistics;innovation,The article emphasizes the students' innovative AI project and its presentation at a significant conference indicating a competitive tone.,353
BGU,09.04.2024,פרסי האגודה הישראלית לכימיה הוענקו לחברי המחלקה לכימיה,https://www.bgu.ac.il/articles/israeli-chemistry-association-awards-2022-2023/,mixed,yes,yes,inter-university;international,chemistry;industry;innovation;awards,The article highlights both collaboration through conferences and awards for recognition.,124
BGU,09.04.2024,מה יכול לסייע בהפחתת תחושת אשמה הורית?,https://www.bgu.ac.il/articles/parental-guilt-duet-study/,neutral,no,no,none,parenting;psychology;research,No signs of competition or collaboration were found.,421
BGU,08.04.2024,לו הייתי בקוביית רוטשילד: אוניברסיטת בן-גוריון מתגייסת לעזרת עמותות שנפגעו במלחמה,https://www.bgu.ac.il/articles/rothchild-cube-for-ngos/,cooperative,yes,no,inter-university;industry;community engagement,social responsibility;philanthropy;community support;war impact,The article emphasizes the university's cooperative efforts with the Rothschild Foundation to support community organizations impacted by war.,296
BGU,07.04.2024,ננו-תרופה חדשה הצליחה לטפל בסרטן מעי גרורתי,https://www.bgu.ac.il/articles/new-nanomedicine-succeeded-in-treating-metastatic-colon-cancer/,mixed,yes,yes,industry,pharmacology;cancer research;innovation,The article features both the development of a novel treatment (competition) and collaboration with a biotech company (cooperation).,728
BGU,07.04.2024,תערוכה חדשה: הרהורים על קולאז',https://www.bgu.ac.il/articles/exhibition-reflections-on-collage-april-may-2024/,neutral,yes,no,industry,art;exhibition;collaboration,The article describes an art exhibition with a focus on collaboration between the artist and curator,437
BGU,07.04.2024,"נפתח מועד הרשמה מיוחד למשרתי ומשרתות מילואים, לתכנית הארבע שנתית ברפואה",https://www.bgu.ac.il/articles/master-medical-recruit/,neutral,no,no,none,admissions;military service,No signs of competition or collaboration were found.,84
BGU,03.04.2024,מענק ERC יוקרתי לחוקר בתחום הקוונטים מהאוניברסיטה,https://www.bgu.ac.il/articles/eran-maniv-erc-starting-grant/,competitive,no,yes,none,quantum physics;research funding;advanced materials,The article emphasizes receiving a prestigious ERC grant and groundbreaking research potential.,200
BGU,03.04.2024,לראשונה בארץ: אוניברסיטת בן-גוריון בנגב מייסדת מרכז מחקר לדיפלומטיית ספורט,https://www.bgu.ac.il/articles/ben-gurion-university-founds-sports-diplomacy-center/,cooperative,yes,no,international,sports diplomacy;international relations;cross-disciplinary research;knowledge exchange,The article highlights the establishment of a center for international collaborations in sports diplomacy.,307
BGU,02.04.2024,מדוע אנו לא מתמידים בתרגילי פיזיותרפיה ביתיים?,https://www.bgu.ac.il/articles/shelly-levy-tzedek-home-physiotherapy-exercises/,cooperative,yes,no,inter-university,physiotherapy;home_exercise;clinical_recommendations,The article highlights collaboration among researchers and presents joint strategies to overcome barriers in physiotherapy.,415
BGU,01.04.2024,כונניות בזמן אמת: מיזם חדשני המספק טיפול נפשי ותמיכה מיידית בתקופת המבחנים,https://www.bgu.ac.il/articles/real-time-on-call/,cooperative,yes,no,inter-university,mental health;student welfare;exam support,The article highlights a collaborative effort to provide immediate mental health support during exams.,460
BGU,01.04.2024,"ברקים ורעמים: תוכניות עילית אקדמיות חדשות של צה""ל והאוניברסיטה נפתחו לעתודאים",https://www.bgu.ac.il/articles/new-elite-academic-programs-idf/,mixed,yes,yes,inter-university;industry;defense;education,academic programs;defense cooperation;regional development;leadership training,The article highlights both the cooperation between institutions for dual degree programs and the uniqueness and necessity of the programs for national security.,358
BGU,31.03.2024,"בתי החולים סורוקה, ברזילי ואסותא אשדוד יקבלו את 'פרס הנשיא' של אוניברסיטת בן-גוריון בנגב",https://www.bgu.ac.il/articles/president-award-2024/,cooperative,yes,no,inter-university;industry;community,healthcare;recognition;community support,The article highlights multiple collaborative efforts and joint recognitions across hospitals and the university.,526
BGU,31.03.2024,לגדל ילדים תחת אש: אימהות בעוטף עזה מתקשות לשמוע קולות בכי של תינוקות,https://www.bgu.ac.il/articles/raising-children-under-fire-research/,neutral,yes,no,none,child development;parenting;psychology,The article is informational,333
BGU,26.03.2024,"יהודית רביץ תקבל תואר ד""ר לשם כבוד מאוניברסיטת בן-גוריון בנגב",https://www.bgu.ac.il/articles/yehudit-ravitz-dr/,neutral,no,no,none,awards;recognition;culture,The article purely informs about the honorary award without signs of competition or collaboration.,247
BGU,25.03.2024,פרופ' איציק מזרחי זיהה מירוץ חימוש היוצר מאזן אימה בין חיידקים טובים לחיידקים רעים,https://www.bgu.ac.il/articles/good-and-bad-germs-itzik-mizrahi/,mixed,yes,yes,international,climate change;probiotic research;innovation;academic awards,The article discusses innovative research with ecological impact and mentions both collaboration and competition aspects.,365
BGU,25.03.2024,אוניברסיטת בן-גוריון בנגב מקימה בית דין מקצועי לטיפול בהטרדות מיניות,https://www.bgu.ac.il/articles/bgu-establishes-professional-sexual-harassment-tribunal/,cooperative,yes,no,inter-university,gender equality;legal reform;university governance,The article highlights collaboration among various university stakeholders to establish a unified disciplinary court.,246
BGU,25.03.2024,בדרך לכבוש את העולם,https://www.bgu.ac.il/articles/tightening-ties-with-academic-institutions/,mixed,yes,yes,international,academic collaboration;research;competition;international relations,The article discusses both the challenges of international academic cooperation and highlights the unique and leading position of the university in various fields.,519
BGU,25.03.2024,ממדים ללימודים: משרתות במילואים ועושות דוקטורט בבן-גוריון,https://www.bgu.ac.il/articles/from-reserve-to-study/,neutral,no,no,none,women's day;military service;academic challenges,No signs of competition or collaboration were found.,788
BGU,25.03.2024,לוחמת למען שוויון,https://www.bgu.ac.il/articles/fighting-for-equality/,mixed,yes,no,inter-university,sociology;gender;military,The article discusses both gender equality initiatives and historical challenges,821
BGU,12.03.2024,"הרוח, החול והמים: הסבר חדש לתופעת גלוני חול בכדור הארץ ובמאדים",https://www.bgu.ac.il/articles/hezi-yizhaq-mars-sand-ripples/,mixed,yes,yes,international;inter-university,earth science;planetary science;collaborative research;atmospheric studies,The article discusses both the international collaboration for research and innovative findings that challenge existing theories.,645
BGU,,עושה מילואים? ערוצי קבלה ייחודיים,https://www.bgu.ac.il/articles/special-admission-iron-swords/,neutral,no,no,none,ERR,ERR,645
BGU,20.02.2024,"אפליה בקולנוע: מודל AI שניתח עשרות אלפי פוסטרים מסחריים של סרטים אמריקניים, מצא ייצוג נרחב לשחקנים לבנים על פני חבריהם מייצוג אתני שונה.",https://www.bgu.ac.il/articles/discrimination-in-cinema/,mixed,yes,yes,inter-university,AI;diversity;cinema;ethnic representation,The article discusses both collaboration in research and highlights issues of ethnic representation in cinema,628
BGU,19.02.2024,שוניות מלאכותיות מגנות על שוניות האלמוגים באילת,https://www.bgu.ac.il/articles/shashar-artificial-reef/,cooperative,yes,no,inter-university;industry;international,environment;marine biology;research collaboration,The article highlights cooperation among various organizations to establish the artificial reef.,466
BGU,13.02.2024,האוניברסיטה ייסדה מכון לאומי לעיצוב וחקר מדיניות אקלים,https://www.bgu.ac.il/articles/national-istitute-for-climate-policy-design-and-research/,cooperative,yes,no,inter-university;industry;government,environment;climate policy;innovation,The article focuses on the collaboration between various sectors to establish a research institute for climate policy advancement.,393
BGU,12.02.2024,ממריאים לעתיד בר-קיימא: מהפכה בייצור דלק תעופתי,https://www.bgu.ac.il/articles/herskowitz-sustainable-aviation-fuel/,mixed,yes,yes,industry;sustainability;innovation,The article highlights both collaboration with CarboNGV and innovative breakthroughs in green aviation technology.,ERR,328
BGU,12.02.2024,פרס האקלים הגדול בתולדות המדינה מוענק ל...,https://www.bgu.ac.il/articles/climate-solution-prize/,competitive,no,yes,none,climate solutions;innovation;energy,The article emphasizes the prestigious award received for groundbreaking research.,181
BGU,12.02.2024,"מינוי חדש באוניברסיטת בן-גוריון בנגב: מולי צפריר, סמנכ""ל טכנולוגיות חדשנות ודיגיטל",https://www.bgu.ac.il/articles/new-cto-24/,neutral,no,no,none,leadership;digital innovation;organizational strategy,No signs of competition or collaboration were found.,154
BGU,08.02.2024,אחים עובריים תורמים לחיזוי ההצלחה של הפריה חוץ גופית,https://www.bgu.ac.il/articles/fetal-siblings/,mixed,yes,yes,industry,artificial intelligence;IVF;genetic research;machine learning,The article highlights both a partnership with a startup and innovations in AI-based IVF treatment predictions.,466
BGU,06.02.2024,דווקא עכשיו: ההייטק מגיע לדרום הארץ,https://www.bgu.ac.il/articles/imtech-now-24/,cooperative,yes,no,inter-university;industry;government,technology;regional development;education,The article emphasizes a collaborative initiative involving multiple organizations to enhance employment opportunities.,670
BGU,06.02.2024,"אקלים יותר נוח: ייצוג מרשים לאוניברסיטת בן-גוריון בנגב בוועד המנהל של ""חיים וסביבה"" ארגון הגג של ארגוני הסביבה בישראל",https://www.bgu.ac.il/articles/better-climate-sviva/,cooperative,yes,no,inter-university,sustainability;environmental_protection;governance,The article highlights collaboration within the environmental movement and appointing faculty members to an environmental organization.,324
BGU,04.02.2024,התגלה מנגנון הגורם לדום נשימה בשינה בקרב ילדים חולים,https://www.bgu.ac.il/articles/vatin-apnea/,cooperative,yes,no,inter-university,genetic research;neurological disorders;collaboration,The article highlights cooperation between two universities to research and potentially treat a rare syndrome.,452
BGU,31.01.2024,עלייה גדולה בשכיחות אוטיזם בישראל,https://www.bgu.ac.il/articles/increase-in-autism-research/,cooperative,yes,no,inter-university;industry;international,autism;public health;child development;education,The article highlights collaboration among multiple institutions for a national study on autism.,739
BGU,28.01.2024,הערך של מודיעין במלחמות בין מיקרו-אורגניזמים,https://www.bgu.ac.il/articles/the-value-of-intelligence-in-microorganisms-wars/,mixed,yes,no,inter-university,biology;research,The article discusses collaboration between universities and the development of a new model,384
BGU,22.01.2024,סובל מחרדה? התגלה קשר דרמטי בין חרדה לטסטוסטרון,https://www.bgu.ac.il/articles/knafo-anxiety-testosterone/,neutral,no,no,none,neuroscience;hormones;anxiety,The article does not emphasize competition or collaboration,703
BGU,21.01.2024,התוכנית שתכשיר מנהיגות צעירה להתמודדות עם משבר האקלים במזרח התיכון,https://www.bgu.ac.il/articles/leadership-climate-in-middle-east-program/,cooperative,yes,no,industry;sustainability;education,The article highlights a partnership with an environmental organization for joint sustainability efforts.,ERR,166
BGU,15.01.2024,אחד מ-100: מדען מאוניברסיטת בן-גוריון בנגב נבחר לרשימת 100 המשפיעים בתחום הפוטוניקה לשנת 2024,https://www.bgu.ac.il/articles/one-of-100/,competitive,no,yes,none,photonics;innovation;industry recognition,The article emphasizes the recognition and achievements of a professor in the field of photonics.,286
BGU,15.01.2024,חבריו של המורה שנרצח ממשיכים את דרכו,https://www.bgu.ac.il/articles/for-ronen/,cooperative,yes,no,inter-university,education;community engagement,The article highlights collaboration between university professors and a high school to support students.,387
BGU,08.01.2024,לומדים לעוף: כיצד ציפורים המושבות לטבע מתגברות על קשיים ולומדות לעוף?,https://www.bgu.ac.il/articles/learning-to-fly/,mixed,yes,yes,inter-university;international,animal behavior;research methods;collaboration,The article discusses both collaborative research efforts and distinct findings regarding the birds' behavior.,332
BGU,28.12.2023,הסבא של המחקר,https://www.bgu.ac.il/articles/grandpa-researcher/,neutral,no,no,none,personal journey;academic achievement,No signs of competition or collaboration were found.,447
BGU,25.12.2023,"נערכים לפתיחת שנה""ל תשפ""ד בצל מלחמת 'חרבות ברזל'",https://www.bgu.ac.il/articles/2024-academic-year/,cooperative,yes,no,none,mental health;community support;student activities,The article emphasizes collective support and solidarity among the university community during challenging times.,329
BGU,21.12.2023,מחזקים את האוכלוסיות החלשות,https://www.bgu.ac.il/articles/strengthening-vulnerable-populationss/,cooperative,yes,no,inter-university,social responsibility;volunteering;community support,The article highlights the university's collaboration with a local nonprofit for food distribution to those in need.,410
BGU,18.12.2023,מלגות יוקרתיות לדוקטורנטיות מהפקולטה למדעי הטבע,https://www.bgu.ac.il/articles/two-women-doctoral-students-win-prestigious-scholarships/,competitive,no,yes,none,scholarships;academic excellence;doctoral research,The article emphasizes prestigious fellowship awards and the academic excellence of the students.,302
BGU,17.12.2023,גם הטבע מגיב ללחץ,https://www.bgu.ac.il/articles/fairy-circles-phenomenon-explained/,cooperative,yes,no,international,ecology;phenotypic adaptation;climate resilience,The article highlights collaboration among international researchers and the development of a mathematical model to solve ecological mysteries.,437
BGU,06.12.2023,צ'אט בוט בוואטסאפ יציל נפגעי הלם תוך פחות מדקה,https://www.bgu.ac.il/articles/state-of-shock-whatsapp-chatbot/,cooperative,yes,no,inter-university,AI;mental_health;crisis_response,The article emphasizes collaboration in developing a model for immediate assistance using AI.,443
