institution,Date,Title,URL,tone,mentions_cooperation,mentions_competition,cooperation_type,thematic_tags,justification,length_words
BGU,19.06.2025,סטודנטים וסטודנטיות לרפואת חירום נרתמים לסייע בפינוי חולים מסורוקה,https://www.bgu.ac.il/articles/following-rocket-strikes-at-soroka-medical-center-emergency-medicine-students-at-bgu-to-help-evacuate-patients/,cooperative,yes,no,industry,emergency response;medical education;community service,The article highlights collaboration with MDA and the Ministry of Health to aid patient evacuation.,196
BGU,16.06.2025,מתרגלים הדמיה רפואית גם מהבית - בבית הספר לרפואה,https://www.bgu.ac.il/articles/medical-students-at-ben-gurion-university-of-the-negev-practice-medical-imaging-from-home/,neutral,no,no,none,medical education;simulation;technology,No signs of competition or collaboration were found.,247
BGU,12.06.2025,השוואה מצמררת: אנלוגיה בין שירת השואה ואירועי 7 באוקטובר,https://www.bgu.ac.il/articles/israeli-documentary-poetry-coming-of-age-with-the-state/,neutral,no,no,none,poetry;literature;Holocaust;Israeli identity,No signs of competition or collaboration were found.,399
BGU,11.06.2025,מחזירים לפצועי המלחמה את המוטיבציה והשליטה,https://www.bgu.ac.il/articles/restoring-motivation-and-control-to-war-wounded/,mixed,yes,yes,international;industry;inter-university,innovation;rehabilitation;technology;social impact,The article highlights both collaborative efforts in development and competitive achievements in winning awards.,547
BGU,10.06.2025,מתנות מן הים: מולקולות מאלמוגים במקום אנטיביוטיקה,https://www.bgu.ac.il/articles/coral-derived-molecules-disrupt-bacterial-communication/,cooperative,yes,no,international,antibiotic resistance;biofilm;quorum sensing,The article highlights international collaboration and joint efforts in research with Nanyang Technological University.,453
BGU,09.06.2025,האוניברסיטה משיקה את בית ספר סגול לרפואה בינלאומית,https://www.bgu.ac.il/articles/bgu-launches-sagol-medical-school-for-international-health/,cooperative,yes,no,inter-university;international,education;healthcare;innovation,The article emphasizes a partnership with Sagol Network to build a global academic and medical infrastructure.,286
BGU,09.06.2025,לא יורדים במשקל? הגוף ממשיך להגיב בעוצמה,https://www.bgu.ac.il/articles/the-weight-loss-resistance-phenomenon/,cooperative,yes,no,international,obesity;nutrition;health benefits;genetics,The article highlights international cooperation among universities for research.,829
BGU,29.05.2025,הנשק מול מחלת הסרטן: תאי T המבוססים על טכנולוגיית ייצור שבבים,https://www.bgu.ac.il/articles/t-cells/,cooperative,yes,no,inter-university;international,cancer research;immunotherapy research;genetic engineering;nanotechnology,The article highlights collaboration between multiple universities and research groups in developing advanced CAR T cell treatments.,828
BGU,26.05.2025,לראשונה מאז שנות ה-90': ספר מקיף חדש על האבולוציה של תכונות מהלך החיים,https://www.bgu.ac.il/articles/michal-sagoli-book/,neutral,no,no,none,evolution;biology;publication;life history,No signs of competition or collaboration were found.,389
BGU,25.05.2025,פרופ' יגאל שוורץ נבחר לאקדמיה הישראלית למדעים,https://www.bgu.ac.il/articles/prof-yigal-schwartz-elected-to-the-israel-academy-of-sciences-and-humanities/,cooperative,yes,no,international,science;literature;academia,The article highlights the collective efforts and contributions to strengthening Israel's position in the global scientific community.,229
BGU,18.05.2025,חוסן חברתי והתמודדות עם משבר ה-7 באוקטובר בקרב קבוצות שונות,https://www.bgu.ac.il/articles/social-resilience-and-engagement-with-the-october-7-crisis/,neutral,yes,no,none,sociology;psychology;multiculturalism,The article focuses on a sociological study without highlighting competition or collaboration.,350
BGU,15.05.2025,הייתה זו שעתם היפה ביותר,https://www.bgu.ac.il/articles/bgu-honorary-doctorates-2025/,neutral,no,no,none,ceremony;recognition;academia;philanthropy;innovation,The article is informative about an honorary doctorate ceremony and does not emphasize competition or collaboration.,1089
BGU,15.05.2025,"לרבע מהשכירים במשק אין פנסיית חובה, מרביתם צעירים מהעשירון התחתון",https://www.bgu.ac.il/articles/quarter-of-employed-do-not-have-a-mandatory-pension/,neutral,no,no,none,pension coverage;employment data;social impact,No signs of competition or collaboration were found.,868
BGU,13.05.2025,חוקרים יצרו מאגר של מודלי שפה המאבחנים מקרים רפואיים מורכבים,https://www.bgu.ac.il/articles/researchers-created-large-scale-database-of-language-models-to-diagnose-complex-medical-cases/,neutral,no,yes,none,language models;medical diagnosis;research findings;performance evaluation,The article evaluates the performance of language models without mentioning collaboration but highlighting comparative analysis and model performances.,527
BGU,07.05.2025,יובל לבית הספר לרפואה באוניברסיטת בן-גוריון בנגב,https://www.bgu.ac.il/articles/jubilee-for-the-school-of-medicine-at-ben-gurion-university-of-the-negev/,mixed,yes,yes,inter-university;international,celebration;healthcare;education;impact,The article highlights both the cooperative aspects of the school's community focus and its competitive achievements and reputation.,457
BGU,06.05.2025,"פרס בלווטניק היוקרתי למדענים צעירים הוענק לד""ר בן פלמר",https://www.bgu.ac.il/articles/ben-palmer-blavatnik-award/,competitive,no,yes,none,awards;innovation;excellence,The article emphasizes prestigious awards and the university's international standing.,501
BGU,05.05.2025,בכבוד רב - הענקת תארי דוקטור לשם כבוד,https://www.bgu.ac.il/articles/honorary-doctorate-2025/,neutral,no,yes,none,awards;distinguished individuals;human excellence;academic achievements;social contribution;artistic influence,The article emphasizes exceptional achievements and awards without highlighting competition or collaboration.,863
BGU,28.04.2025,צ'אט עם דוד בן-גוריון,https://www.bgu.ac.il/articles/chat-dbg/,mixed,yes,yes,industry;technology;history;innovation;heritage,The article discusses both the collaboration with tech companies and innovative historical presentation, without any dominant aspect.,586
BGU,21.04.2025,"פרס יוקרתי לדוקטורנט תום גבריאלי,  בכנס האגודה האמריקאית לגיאופיזיקה",https://www.bgu.ac.il/articles/tom-gavrieli/,competitive,no,yes,none,seismology;awards;innovation,The article emphasizes the prestigious award won by a student at a major conference.,228
BGU,09.04.2025,אלגוריתם חדש מפענח את סודות החלבונים שלנו,https://www.bgu.ac.il/articles/ai-algorithm-spots-hidden-disease-clues-in-protein-networks/,cooperative,yes,no,inter-university;industry;international,biotechnology;bioinformatics;network analysis;healthcare;open access,The article highlights collaboration between researchers from different fields and institutions for developing the algorithm.,316
BGU,09.04.2025,גבולות נזילים: תערוכה חדשה בגלריית טרומפלדור,https://www.bgu.ac.il/articles/liquid-borders/,cooperative,yes,no,inter-university,art;exhibition;boundaries;Israeli society,The article highlights a collaboration between the university's arts department and the Trompldor Gallery for the exhibition.,290
BGU,06.04.2025,המרפא למצוקות שנגרמו מהמלחמה: ספרי ילדים,https://www.bgu.ac.il/articles/student-project-will-help-children-cope-with-the-consequences-of-war/,cooperative,yes,no,inter-university,psychology;childrens literature;community support;mental health,The article highlights a collaborative project involving multiple departments and experts to support mental health through children's literature.,325
BGU,02.04.2025,"ברשימת החוקרים המובילים בתחום התפלת מים:  ד""ר עודד ניר ממכון צוקרברג לחקר המים",https://www.bgu.ac.il/articles/water-desalination-dr-oded-nir-the-desert-research-institutes/,competitive,no,yes,none,desalination;innovative research;awards,The article emphasizes the prestigious recognition and the innovative contributions of Dr. Nir.,185
BGU,25.03.2025,שכנות טובה: נחתם הסכם לשיתוף פעולה עם מרכז מצוינות מקפריסין,https://www.bgu.ac.il/articles/good-neighbors/,cooperative,yes,no,international,research;space;collaboration,The article emphasizes regional and international collaborations in space research.,196
BGU,25.03.2025,איך נולד מחקר בין תחומי?,https://www.bgu.ac.il/articles/how-interdisciplinary-research-is-born/,cooperative,yes,no,inter-university;international,interdisciplinary research;networking;academic collaboration,The article emphasizes inter-university collaboration initiatives led by Ben-Gurion University to promote interdisciplinary research.,376
BGU,24.03.2025,אירועי יום האישה 2025,https://www.bgu.ac.il/articles/womens-day-25/,competitive,no,yes,none,gender equality;awards;events,The article highlights the university's recognition in gender equality by a high-ranking council.,168
BGU,19.03.2025,מרכז יזמות 360 של האוניברסיטה זכה בפרס החדשנות של INSA לשנת 2024,https://www.bgu.ac.il/articles/yazamut-insa-2024/,competitive,yes,yes,industry;innovation;entrepreneurship;education,The article emphasizes the center's award and achievements in entrepreneurship education and innovation.,ERR,417
BGU,18.03.2025,פנטזיה במינון יתר: חלומות בהקיץ יכולים להיות בעיה גדולה משחשבתם,https://www.bgu.ac.il/articles/maladaptive-daydreaming/,mixed,yes,yes,inter-university,psychology;mental health;research,The article highlights both the collaborative effort between universities and the aim for significant recognition in psychiatric guidelines.,422
BGU,17.03.2025,"המל""ג הכירה באוניברסיטה כמוסד מצטיין בתחום ההוגנות המגדרית",https://www.bgu.ac.il/articles/bgu-rewarded-for-gender-equity/,mixed,yes,yes,none,gender equality;support for women;academic advancement,The article highlights both the university's achievements in gender equality and its initiatives for further collaboration and development.,280
BGU,17.03.2025,הגברים בוכים בלילה,https://www.bgu.ac.il/articles/men-cry-at-night-research/,cooperative,yes,no,inter-university,social issues;gender studies;psychology,The article highlights collaboration between Ben-Gurion University and Princeton University for research on gender roles.,761
BGU,13.03.2025,"השלכות מלחמת ""חרבות ברזל"" על מצוקה נפשית עלייה בקרב צעירים וצעירות ישראליים",https://www.bgu.ac.il/articles/significant-increase-in-levels-of-mental-distress-among-young-israeli-men-and-women/,neutral,no,no,none,psychological distress;resilience;public health,No signs of competition or collaboration were found.,584
BGU,10.03.2025,מה חשוב יותר בשומן התוך בטני- כמות או פרופורציה?,https://www.bgu.ac.il/articles/what-is-more-important-in-intra-abdominal-fat-quantity-or-proportion/,mixed,yes,yes,inter-university;international,nutrition;visceral_fat;health_research;collaboration,The article describes both a large cooperative research effort and scientific competition by addressing a debated topic in health research.,776
BGU,10.03.2025,מיקרוסופט והאוניברסיטה הכריזו של שיתוף פעולה מחקרי,https://www.bgu.ac.il/articles/microsoft-and-bgu-announce-collaboration-for-security-and-artificial-intelligence-research/,cooperative,yes,no,industry,AI;cybersecurity;innovation,The article highlights a collaboration between Microsoft and the university for joint research in AI and cybersecurity.,346
BGU,10.03.2025,גבולות אגני הניקוז משתנים מהר יותר בעקבות שינויי האקלים,https://www.bgu.ac.il/articles/drainage-basin-boundaries-are-changing-faster-due-to-climate-change/,cooperative,yes,no,international,geology;climate change;water management,The article highlights an international collaboration in research on geological and climatic phenomena.,469
BGU,04.03.2025,פרס החברה לכימיה הוענק לחוקרים מהאוניברסיטה,https://www.bgu.ac.il/articles/chemical-society-awards-for-2024/,competitive,no,yes,none,awards;recognition;chemistry,The article emphasizes awards and recognition given to outstanding scientists.,350
BGU,02.03.2025,אפס פליטת פחמן עד 2050?,https://www.bgu.ac.il/articles/zero-carbon-emissions-by-2050-additional-steps-needed-besides-technology/,mixed,yes,yes,inter-university;sustainability;population growth;technological innovation,The article discusses both cooperative research efforts and presents unique challenges faced by Israel compared to other countries.,ERR,337
BGU,02.03.2025,"נא להכיר: נועה דקל, יושבת ראש האגודה הסטודנטיאלית",https://www.bgu.ac.il/articles/noa-dekel-student-union/,cooperative,yes,no,inter-university,student support;community involvement;military service,The article focuses on collaboration with the university to support students returning from military service.,605
BGU,23.02.2025,נתונים מפתיעים על הסיכון לפציעות בקרב ילדים עם לקויות התפתחותיות,https://www.bgu.ac.il/articles/children-with-asd-less-likely-to-have-severe-injuries-than-those-with-adhd/,cooperative,yes,no,inter-university;industry,epidemiology;neurodevelopmental disorders;public health;child safety,The article highlights collaboration between universities and healthcare institutions for joint research.,353
BGU,19.02.2025,מרוטרי בהוקרה: פרס הצטיינות לאוניברסיטה על תרומתה לקידומה של מדינת ישראל,https://www.bgu.ac.il/articles/from-rotary-in-recognition-an-award-of-excellence-to-ben-gurion-university-of-the-negev/,neutral,no,no,none,recognition;events;community engagement,No signs of competition or collaboration were found.,225
BGU,17.02.2025,התגלו סוגים חדשים של תאי שומן בגוף האדם,https://www.bgu.ac.il/articles/new-types-of-fat-cells-have-been-discovered-in-the-human-body/,cooperative,yes,no,international,genetics;health;collaboration,The article emphasizes international collaboration among various universities for research purposes.,801
BGU,17.02.2025,"""לימדת אותנו שיעור בנחישות""",https://www.bgu.ac.il/articles/you-taught-us-a-lesson-in-determination/,neutral,no,no,none,community engagement;support,No signs of competition or collaboration were found.,212
BGU,17.02.2025,היכן יוצרו 'העתיקות המואביות'?,https://www.bgu.ac.il/articles/where-were-the-moabite-antiquities-produced/,neutral,yes,no,inter-university,archaeology;research collaboration;historical analysis,The article is informative and focuses on archaeological research without signs of competition or collaboration beyond inter-university cooperation.,1025
BGU,12.02.2025,האוניברסיטה מרחיבה את התמיכה במשרתי ומשרתות המילואים,https://www.bgu.ac.il/articles/support-for-students-in-reserve-services/,cooperative,yes,no,none,student welfare;military support;academic assistance,The article emphasizes the university's extensive support measures and collaborative efforts to aid reservist students.,355
BGU,11.02.2025,אבחון מאוחר של אוטיזם,https://www.bgu.ac.il/articles/late-autism-diagnosis-research/,mixed,yes,yes,inter-university,autism;diagnosis;early childhood;research methodology,The article highlights both collaboration with Boston Children's Hospital and the unique findings of the research.,355
BGU,06.02.2025,"הוענקו פרסי הצטיינות וחדשנות בהוראה לשנת תשפ""ד",https://www.bgu.ac.il/articles/excellence-in-teaching-awards-2025/,competitive,no,yes,none,academic excellence;military service;teaching innovation,The article emphasizes awards and recognition given to exceptional faculty for their teaching excellence and innovative practices.,377
BGU,03.02.2025,פרס ברונו היוקרתי לחוקרים מבטיחים הוענק לפרופ' יצחק מזרחי,https://www.bgu.ac.il/articles/prestigious-bruno-award-awarded-to-prof-yitzhak-mizrahi/,competitive,no,yes,none,awards;achievements;microbial ecology,The article emphasizes the prestigious award and outstanding achievements of Professor Mizrahi.,150
BGU,02.02.2025,נחתם הסכם שיתוף פעולה בין האוניברסיטה לבין אוניברסיטת אברבנאל בארגנטינה,https://www.bgu.ac.il/articles/cooperation-agreement-was-signed-between-bgu-and-the-university-of-abarbanal-in-argentina/,cooperative,yes,no,international,academic collaboration;innovation;interfaith studies;entrepreneurship,The article highlights a new international academic cooperation agreement with another university.,120
BGU,29.01.2025,הכנס הארצי הראשון לגיוון והכלה באקדמיה נערך באוניברסיטה,https://www.bgu.ac.il/articles/de-conference-2025/,cooperative,yes,no,inter-university,diversity;inclusion;challenges;academe;social_mobility,The article highlights cooperation between universities and organizations to promote diversity and inclusion.,354
BGU,27.01.2025,"הפרס החשוב ביותר לספרים בתחומי מדעי היהדות הוענק לד""ר אביעד מורנו",https://www.bgu.ac.il/articles/bgu-winners-of-national-jewish-book-awards/,competitive,no,yes,none,awards;Jewish studies;Middle Eastern studies;North African studies,The article emphasizes the winning of a prestigious award highlighting competition in the academic field.,263
BGU,23.01.2025,מנהלים בכירים ייעזרו ב-AI לפתרון סוגיות וייעול תהליכים,https://www.bgu.ac.il/articles/ai-for-managers/,neutral,no,no,none,artificial intelligence;executive education;technology integration,No signs of competition or collaboration were found.,232
BGU,23.01.2025,פסטיבל המחקר השלישי נערך בסימן חישוביות ומדעי הרוח,https://www.bgu.ac.il/articles/3rd-research-festival/,cooperative,yes,no,inter-university,artificial intelligence;interdisciplinary studies;research promotion,The article highlights interdisciplinary research promotion and collaboration with another university.,285
BGU,21.01.2025,הושקה מעבדה לפתרון סוגיות עירוניות ומרחביות באמצעים טכנולוגיים,https://www.bgu.ac.il/articles/nur/,cooperative,yes,no,international;inter-university,urban planning;sustainability;innovation,The article emphasizes international and inter-university collaboration for urban innovation.,598
BGU,21.01.2025,מסע בזמן: כיצד נוצרו התא המורכב הראשון בעולם?,https://www.bgu.ac.il/articles/archaea/,cooperative,yes,no,international,evolution;cell biology;archaea,The article highlights collaboration with international researchers from Germany.,295
BGU,20.01.2025,"אוניברסיטת בן-גוריון בנגב תארח את הכנס הקרוב מטעם האו""ם בנושא: 'נשים וחלל'",https://www.bgu.ac.il/articles/space/,cooperative,yes,no,international,women's empowerment;space;STEM;international collaboration,The article emphasizes international collaboration to promote gender equality in space-related fields.,221
BGU,19.01.2025,אין יותר ויכוח: מועדון הדיבייט של האוניברסיטה בצמרת העולמית,https://www.bgu.ac.il/articles/debate-champions-2024/,competitive,no,yes,none,debate;international competition;university representation,The article emphasizes the university's success in national and international debate competitions,495
BGU,08.01.2025,אקדמיה בעלייה:  יחידת עולים ראשונה מסוגה הוקמה באוניברסיטה,https://www.bgu.ac.il/articles/aliya-at-bgu/,cooperative,yes,no,inter-university,immigration;higher education;support systems,The article highlights cooperation with the Ministry of Aliyah and Integration to support new immigrant students.,348
BGU,05.01.2025,פרס מפעל חיים לפרופ' סמי בוסיבא,https://www.bgu.ac.il/articles/busiba/,competitive,no,yes,none,scientific_research;awards_and_recognition,The article emphasizes the scientist's prestigious international award and recognition.,161
BGU,31.12.2024,מעט מן האור דוחה הרבה מן החושך,https://www.bgu.ac.il/articles/light-2025/,neutral,no,no,none,holidays;celebration,No signs of competition or collaboration were found.,11
BGU,25.12.2024,מענק של 1.5 מיליון דולר מטעם קרן אלן הוענק לפרופ' אסף זריצקי,https://www.bgu.ac.il/articles/zaritsky-allen-distinguished-investigators-award/,cooperative,yes,no,international,biology;cell differentiation;microscopy;multidisciplinary collaboration,The article highlights a collaborative international research project involving multiple institutions.,368
BGU,25.12.2024,מחקר חדש: היכולת למלא אחר הוראות - מפתח קריטי להצלחת השיקום לאחר שבץ,https://www.bgu.ac.il/articles/research-following-instructions-key-to-stroke-rehabilitation/,neutral,yes,no,inter-university,cognitive impairment;stroke recovery;neuropsychology,The article is informative about a research study without emphasizing competition or collaboration.,423
BGU,24.12.2024,ים של הצלחות - בכנס מדעי שהתקיים בקמפוס אילת,https://www.bgu.ac.il/articles/sea-of-success-in-eilat/,cooperative,yes,no,inter-university;industry;international,marine science;innovation;education,The article highlights a collaboration between various institutions and organizations for a scientific conference.,140
BGU,19.12.2024,תודה על כל מה שנתתם,https://www.bgu.ac.il/articles/miluim/,cooperative,yes,no,none,scholarships;military service;student support,The article highlights the university's support for students through scholarships and appreciation events.,237
BGU,19.12.2024,מהמעבדה לסטארטאפ:  דוקטורנטים הופכים מחקר אקדמי לסטארטאפים,https://www.bgu.ac.il/articles/startup/,mixed,yes,yes,industry;research;innovation;entrepreneurship,The article highlights collaboration through a government-sponsored program and also emphasizes innovation and significant achievements of the participants.,ERR,508
BGU,17.12.2024,אבחון של...הורים: מערכת היחסים המורכבת בין מורים והורים,https://www.bgu.ac.il/articles/diagnosis-of-parents/,neutral,yes,no,none,education;parental_involvement;teacher_training,The article discusses both challenges and potential benefits of parent-teacher collaboration without a strong emphasis on either cooperation or competition.,529
BGU,15.12.2024,שיטה ייחודית מעולם הרפואה תציל את האלמוגים,https://www.bgu.ac.il/articles/unique-method-from-the-world-of-medicine-will-save-the-corals/,cooperative,yes,no,inter-university;international,marine_biology;climate_change;stem_cells;environmental_protection,The article highlights collaborative efforts between multiple universities to address environmental challenges through research.,626
BGU,15.12.2024,הגידו כן לזקן,https://www.bgu.ac.il/articles/say-yes-to-zaken/,neutral,yes,no,inter-university;government,conference;Negev development;government involvement,No signs of competition or collaboration were found.,291
BGU,15.12.2024,מסע בין כוכבים: תואר ראשון ושני בפיזיקה תוך ארבע שנים,https://www.bgu.ac.il/articles/star-trek-bachelors-and-masters-in-physics-in-four-years/,cooperative,yes,no,inter-university;industry;military,academic program;military cooperation;physics research,The article highlights a partnership between multiple institutions for a joint academic program.,308
BGU,10.12.2024,לתפארת בן-גוריון: האיחוד של נועה ארגמני והסטודנטים שפעלו לשחרורה,https://www.bgu.ac.il/articles/bengurionprize/,cooperative,yes,no,inter-university;community,awards;collaboration;students;leadership;rescue,The article highlights the collaborative efforts of students for a common cause.,717
BGU,05.12.2024,'לילה סגול' גם באוניברסיטת בן-גוריון בנגב  בסימן הצדעה לנפגעי המלחמה בגוף ובנפש,https://www.bgu.ac.il/articles/purple-night-3-12-2024/,cooperative,yes,no,none,community_support;awareness,The article highlights support and assistance initiatives for war victims and emphasizes collective goals and unity.,80
